answer,question,passage
True:,Были ли у сулеймана братья??,"Ещё одной из причин отступления Ахмеда от правил явилось влияние матери Сулеймана Кёсем, которая, опасаясь за жизнь сыновей, не желала после смерти султана видеть на троне шехзаде Османа, матерью которого была другая наложница. В итоге, после смерти отца Сулеймана на троне оказался его слабоумный дядя. Правление бездетного Мустафы было недолгим: в 1618 году произошёл переворот и на троне оказался Осман II. Влияние Кёсем помогло сохранить жизнь её сыновьям и в этот раз. Четыре года спустя произошёл очередной переворот: Осман был свергнут и убит."
True:,Были ли у сулеймана братья??,"Шехзаде́ Сулейма́н  — сын османского султана Ахмеда I и, вероятно,  Кёсем Султан. Шехзаде Сулейман родился в 1610/1611 году и был пятым сыном султана Ахмеда I и, вероятно, третьим сыном Кёсем Султан. После смерти Ахмеда I на трон должен был взойти единокровный брат Сулеймана, Осман II, а самого шехзаде, как и его братьев ждала незавидная участь — всех их должны были казнить по закону Фатиха. Однако несколькими годами ранее Ахмед I сохранил жизнь брату Мустафе уже после рождения собственных сыновей. Историки считают, что Ахмед I посчитал брата неспособным угрожать его правлению в виду явной психической болезни."
False:,Был ли бриллиант на титанике??,"5 апреля 2012 года, в год 100-летия легендарной катастрофы и 15-летия выпуска фильма состоялась премьера этого фильма в формате 3D и IMAX 3D. В 2017 году фильм был выбран для сохранения в Национальном реестре фильмов США. В 1996 году охотник за сокровищами Брок Лаветт и его команда на научно-исследовательском судне «Академик Мстислав Келдыш» на глубоководных батискафах «Мир-1» и «Мир-2» погружаются на дно Атлантического океана, где покоятся останки лайнера «Титаник», затонувшего 15 апреля 1912 года. Они обнаруживают сейф, в котором, по предположению Лаветта, должно находиться ожерелье с голубым бриллиантом, известное как «Сердце океана». В начале XX века один питтсбургский Ротшильд Натан Хокли приобрёл его для своего сына-промышленника Каледона, который подарил ожерелье в качестве свадебного подарка своей невесте — англичанке Розе Дьюитт Бьюкейтер, вместе с которой он плыл на «Титанике» в США, где они должны были пожениться."
True:,Был ли бунин в эмиграции??,"«Тёмные алле́и» — сборник рассказов о любви И. А. Бунина. Над «Тёмными аллеями» Бунин работал в эмиграции с 1937 по 1944 годы. Многие рассказы были написаны во время Второй мировой войны на юге Франции в городе Грасе, в очень стеснённых условиях вишистского режима. Позже, в 1953 году, добавив к своему сборнику два рассказа, автор стал считать «Тёмные аллеи» своим лучшим произведением. Произведение входит в программу изучения литературы в российских общеобразовательных школах."
True:,Был на зоне бунт??,"Бунт заключённых в следственном изоляторе города Сухуми 11 августа 1990 года — один из самых известных бунтов заключённых в истории СССР и России. В 1989 году, когда национальная обстановка в Абхазской АССР серьёзно осложнилась, Министерство внутренних дел СССР приняло решение о массовом изъятии нелегального оружия у населения республики. Часть изъятого оружия, около трёх тысяч единиц огнестрельного оружия и десятки тысяч единиц боеприпасов, была помещена в следственном изоляторе города Сухуми. Во главе бунта стояли два человека — некие Павел Прунчак и Мирон Дзидзария. Из характеристики на Павла Прунчака: Дзидзария также был приговорён к смертной казни за убийства."
True:,Был на зоне бунт в 1990 году??,"Восстание в тюрьме Спач  — восстание заключённых албанской тюрьмы Спач 21-23 мая 1973 года. Тюремный бунт, спровоцированный жестокостью порядков содержания, перерос в политический протест под антикоммунистическими лозунгами. Около двух суток тюрьма контролировалась заключёнными и была провозглашена освобождённой территорией Албании. Выступление подавлено силами Сигурими и полиции при армейской поддержке. Лидеры казнены или получили дополнительные сроки заключения."
True:,Был ли бурито в группе бандерос??,"Игорь Юрьевич Бурнышев  — российский автор-исполнитель, солист группы Burito, бывший участник группы «Банд’Эрос», режиссёр-постановщик, телеведущий, клипмейкер, актёр, диджей. В 1994 году окончил школу № 49 в Ижевске и поступил в Удмуртское училище культуры  на специальность «РТП». До 1996 года параллельно с учёбой работал на радиостанции «Радуга» ведущим прямого эфира. В училище окончил два курса, после чего переехал в Москву. В 1996 году поступил в Московский государственный университет культуры и искусств на специальность «Режиссёр театрализованных представлений и шоу-программ» на курс Владимира Соломоновича Маганета, где обучался в период с 1996 по 2001 годы."
False:,Были ли у андрея болконского прототип??,"I, 1, III. Не имеет ярко выраженных прототипов. Элементы военной карьеры прослеживаются в судьбе Николая Тучкова, Фёдора Тизенгаузена и Петра Волконского. Неудавшийся брак Наташи и Андрея частично срисован с неудавшегося брака Кузьминской и брата писателя Сергея — однако эти отношения не сложились из-за того, что Сергей не отказался от побочной семьи с цыганкой. Елизавета Карловна Болконская  , жена князя Андрея."
True:,Были ли у андрея болконского прототип??,"Андре́й Никола́евич Болко́нский  — один из центральных персонажей романа Л. Н. Толстого «Война и мир». Сын князя Николая Андреевича Болконского. Не имеет точных прототипов из реальной жизни. Некоторые элементы военной карьеры князя Андрея могли быть списаны с биографий Н. А. Тучкова, Ф. И. Тизенгаузена и Петра Михайловича Волконского. Сюжет помолвки Наташи и Андрея частично срисован с неудачной женитьбы Т. А. Кузьминской и старшего брата писателя — С. Н. Толстого."
True:,Были ли гладиаторы в древней италии??,"Гладиа́тор  — боец в Древнем Риме, который сражался с подобными себе на забаву публике на специальных аренах за право быть освобожденным от рабства. Основной причиной возникновения гладиаторских игр являлся заимствованный у этрусков погребальный обряд, подобный древней борьбе сумо в Японии. Потенциальные жертвы человеческих жертвоприношений — не только рабы, но и свободные — должны были с мечами в руках сражаться около могилы, и, таким образом, погибал слабый, а сильный оставался в живых, вызывая восторг присутствующих. Многие рабы добровольно старались попасть в школу гладиаторов, так как сражаясь на арене и завоевывая любовь публики, они могли завоевать себе свободу. Нередко рабы затевали драки между собой, чтобы таким образом показать свою силу перед хозяевами."
True:,Были ли гладиаторы в древней италии??,"Спарта́к  — руководитель восстания рабов и гладиаторов в Италии в 73—71 годах до н. э. Был фракийцем, при до конца не ясных обстоятельствах стал рабом, а позже — гладиатором. В 73 году до н. э. вместе с 70 сторонниками бежал из гладиаторской школы в Капуе, укрылся на Везувии и разбил высланный против него отряд. В дальнейшем смог создать сильную и относительно дисциплинированную армию из рабов и италийской бедноты и нанести римлянам ряд серьёзных поражений. В 72 году до н. э. он разбил обоих консулов, его армия выросла, по разным сведениям, до 70 или даже до 120 тысяч человек. С боями Спартак дошёл до северных границ Италии, по-видимому, предполагая перейти Альпы, но потом повернул обратно."
True:,Были ли ромео и джульетта на самом деле??,"Джулье́тта Капуле́тти  — главная героиня трагедии Уильяма Шекспира «Ромео и Джульетта», возлюбленная юноши Ромео Монтекки, с семьёй которого Капулетти состоят в давней вражде. История Ромео и Джульетты появилась задолго до написания известной трагедии английским драматургом. В её честь назван спутник планеты Уран, открытый 3 января 1986 года по снимкам аппарата «Вояджер-2». Истоки образов двух несчастных влюблённых появляется ещё у Овидия в его поэме о Пираме и Фисбе «Метаморфозы». Имена Ромео и Джульетты впервые используются в автобиографическом произведении Луиджи да Порто «Новонайденная история двух благородных влюблённых» , причём действие происходит именно в городе Вероне."
True:,Были ли женаты ленин и крупская??,"Наде́жда Константи́новна Кру́пская,  февраля 1869 год, Санкт-Петербург, Российская империя — 27 февраля 1939 года, Москва, РСФСР, СССР) — российская революционерка, советский государственный, партийный, общественный и культурный деятель, организатор и главный идеолог советского образования и коммунистического воспитания молодёжи. Супруга 1-го председателя Совета Народных Комиссаров СССР Владимира Ильича Ленина. Доктор педагогических наук. Почётный член АН СССР . Член Президиума Верховного Совета СССР."
True:,Были ли татары в золотой орде??,"Закрепление великого княжения за московскими князьями способствовало процессу восстановления единства Руси, являвшегося основой дальнейших шагов по преодолению золотоордынского ига. В конце 1440-х годов хан Большой Орды Сеид-Ахмед начинает военные действия против Великого княжества Московского. В 1449 году «скорые татарове Седядахматовы» напали на южные московские земли, но на реке Пахре были разбиты служилыми татарами под командованием царевича Касима, вышедшего из Звенигорода. В 1450 году татарские отряды под предводительством Малымбердея попытались напасть на южнорусские земли, но были встречены и разбиты русскими полками в бою на реке Битюг. В июне 1451 года сын Сеид-Ахмеда Мазовша с конницей смог переправиться через р. Оку и прорвался к Москве."
True:,Были ли татары в золотой орде??,"Монго́ло-тата́рское и́го, татаро-монгольское иго, монгольское иго, татарское иго, ордынское иго — система политической и даннической зависимости русских княжеств от Монгольской империи до 1260-х годов, позже, после распада Монгольской империи, от Золотой Орды до конца XV века. Установление ига стало возможным в результате монгольского нашествия на Русь в 1237—1242 годах; иго устанавливалось в течение двух десятилетий после нашествия, в том числе и в неразорённых землях. В Северо-Восточной Руси длилось до 1480 года. В других русских землях устранялось в XIV веке по мере присоединения их к Великому княжеству Литовскому и Польше. В 2013 году стало известно, что иго будет входить в единый учебник истории России под названием «ордынское владычество»."
False:,Были ли у казахов фамилии??,"Казахская фамилия  — первая часть современного казахского имени. У древних казахов было только имя, и по прошествии некоторого времени к нему добавлялось какое-нибудь слово, характеризовавшее его. Например, Богенбай был батыром, значит он звался Богенбай-батыр, Бухар был великим жырау, значит Бухар-жырау, или Балуан-шолак, от того что он был шолак — без руки, то есть их социальный статус давал им полное имя. При замужестве девичья фамилия обычно сохраняется. Например, Дарига Назарбаева при замужестве фамилию не меняла."
